{
	"$schema": "theme-schema.json",
	"name": "ocean",
	"vars": {
		"cyan": "#4FC3F7",
		"blue": "#5B9BF2",
		"green": "#89C985",
		"red": "#F07178",
		"yellow": "#FFCB6B",
		"gray": "#7A8494",
		"dimGray": "#555F6E",
		"darkGray": "#3A4150",
		"accent": "#4ECDC4",
		"selectedBg": "#2A3142",
		"userMsgBg": "#1E2433",
		"toolPendingBg": "#1E2233",
		"toolSuccessBg": "#1B2B24",
		"toolErrorBg": "#2E1E24",
		"customMsgBg": "#231E33"
	},
	"colors": {
		"accent": "accent",
		"border": "blue",
		"borderAccent": "cyan",
		"borderMuted": "darkGray",
		"success": "green",
		"error": "red",
		"warning": "yellow",
		"muted": "gray",
		"dim": "dimGray",
		"text": "",
		"thinkingText": "gray",
		"selectedBg": "selectedBg",
		"userMessageBg": "userMsgBg",
		"userMessageText": "",
		"customMessageBg": "customMsgBg",
		"customMessageText": "",
		"customMessageLabel": "#AB82D4",
		"toolPendingBg": "toolPendingBg",
		"toolSuccessBg": "toolSuccessBg",
		"toolErrorBg": "toolErrorBg",
		"toolTitle": "",
		"toolOutput": "gray",
		"mdHeading": "#FFCB6B",
		"mdLink": "cyan",
		"mdLinkUrl": "dimGray",
		"mdCode": "accent",
		"mdCodeBlock": "green",
		"mdCodeBlockBorder": "darkGray",
		"mdQuote": "gray",
		"mdQuoteBorder": "darkGray",
		"mdHr": "darkGray",
		"mdListBullet": "accent",
		"toolDiffAdded": "green",
		"toolDiffRemoved": "red",
		"toolDiffContext": "gray",
		"syntaxComment": "#546E7A",
		"syntaxKeyword": "#82AAFF",
		"syntaxFunction": "#82AAFF",
		"syntaxVariable": "#EEFFFF",
		"syntaxString": "#C3E88D",
		"syntaxNumber": "#F78C6C",
		"syntaxType": "#4ECDC4",
		"syntaxOperator": "#89DDFF",
		"syntaxPunctuation": "#89DDFF",
		"thinkingOff": "cyan",
		"thinkingMinimal": "#4A5568",
		"thinkingLow": "#4A7FBF",
		"thinkingMedium": "#5B9BF2",
		"thinkingHigh": "#9B7FD4",
		"thinkingXhigh": "#C77DFF",
		"bashMode": "green"
	},
	"export": {
		"pageBg": "#0F1117",
		"cardBg": "#161B27",
		"infoBg": "#1E2B1E"
	},
	"web": {
		"label": "Ocean",
		"mode": "dark",
		"tokens": {
			"bg": "#0e1520",
			"surface": "#141d2b",
			"surface-2": "#1b2738",
			"border": "#233246",
			"fg": "#d3dce8",
			"muted": "#71829c",
			"accent": "#5b9dff",
			"accent-fg": "#ffffff",
			"link": "#7cb3ff",
			"success": "#45b383",
			"warning": "#d4a04a",
			"danger": "#e06070"
		},
		"css": "/* A slow, faint current over the app: drifting light + a low swell at the\n   bottom edge. Fades in once the launch splash leaves. */\nbody::before,\nbody::after {\n\tcontent: \"\";\n\tposition: fixed;\n\tz-index: 1;\n\tpointer-events: none;\n\ttransition: opacity 1.6s ease;\n}\nbody::before {\n\tinset: -25%;\n\tbackground:\n\t\tradial-gradient(32% 26% at 22% 30%, rgba(78, 205, 196, 0.07), transparent 70%),\n\t\tradial-gradient(30% 24% at 76% 62%, rgba(91, 157, 255, 0.06), transparent 70%),\n\t\tradial-gradient(26% 20% at 55% 12%, rgba(124, 179, 255, 0.045), transparent 70%);\n\twill-change: transform;\n\tanimation: ocean-current 46s ease-in-out infinite alternate;\n}\nbody::after {\n\tleft: 0;\n\tright: 0;\n\tbottom: 0;\n\theight: 110px;\n\tbackground-image:\n\t\turl(\"data:image/svg+xml,%3Csvg xmlns='http://www.w3.org/2000/svg' viewBox='0 0 1600 200' preserveAspectRatio='none'%3E%3Cpath fill='%235b9dff' fill-opacity='0.035' d='M0 100C200 40 600 40 800 100S1400 160 1600 100V200H0Z'/%3E%3C/svg%3E\"),\n\t\turl(\"data:image/svg+xml,%3Csvg xmlns='http://www.w3.org/2000/svg' viewBox='0 0 1600 200' preserveAspectRatio='none'%3E%3Cpath fill='%234ecdc4' fill-opacity='0.04' d='M0 100C200 40 600 40 800 100S1400 160 1600 100V200H0Z'/%3E%3C/svg%3E\");\n\tbackground-repeat: repeat-x;\n\tbackground-position: 0 100%, 0 100%;\n\tbackground-size: 900px 60%, 1400px 100%;\n\tanimation: ocean-drift 70s linear infinite;\n}\nhtml[data-pizza-phase=\"boot\"] body::before,\nhtml[data-pizza-phase=\"boot\"] body::after {\n\topacity: 0;\n}\n@keyframes ocean-current {\n\t0% { transform: translate3d(0, 0, 0) rotate(0deg); }\n\t50% { transform: translate3d(3%, -2%, 0) rotate(2deg); }\n\t100% { transform: translate3d(-2%, 2%, 0) rotate(-1.5deg); }\n}\n@keyframes ocean-drift {\n\tto { background-position: -1800px 100%, -1400px 100%; }\n}\n/* Reduced motion: greatly slowed, not removed — ambient drift only. */\n@media (prefers-reduced-motion: reduce) {\n\tbody::before {\n\t\tanimation-duration: 120s;\n\t}\n\tbody::after {\n\t\tanimation-duration: 160s;\n\t}\n}",
		"splash": {
			"css": ".pizza-splash {\n\tbackground:\n\t\tradial-gradient(120% 70% at 50% -10%, #1d4a6b 0%, rgba(29, 74, 107, 0) 60%),\n\t\tlinear-gradient(180deg, #0f2236 0%, #0b1826 55%, #07111c 100%);\n\ttransition: opacity 700ms ease, visibility 0s linear 700ms;\n}\n/* Caustic light drifting through the water. */\n.pizza-splash__backdrop::before {\n\tcontent: \"\";\n\tposition: absolute;\n\tinset: -30%;\n\tbackground:\n\t\tradial-gradient(28% 22% at 30% 35%, rgba(78, 205, 196, 0.22), transparent 70%),\n\t\tradial-gradient(24% 20% at 70% 30%, rgba(91, 157, 255, 0.2), transparent 70%),\n\t\tradial-gradient(30% 18% at 50% 60%, rgba(124, 179, 255, 0.12), transparent 70%);\n\tanimation: ocean-caustics 7s ease-in-out infinite alternate;\n}\n/* Three swell layers rolling at parallax speeds (front fastest). */\n.pizza-splash__backdrop::after {\n\tcontent: \"\";\n\tposition: absolute;\n\tleft: 0;\n\tright: 0;\n\tbottom: -12px;\n\theight: 44%;\n\tbackground-image:\n\t\turl(\"data:image/svg+xml,%3Csvg xmlns='http://www.w3.org/2000/svg' viewBox='0 0 1600 200' preserveAspectRatio='none'%3E%3Cpath fill='%23081424' fill-opacity='0.92' d='M0 100C200 40 600 40 800 100S1400 160 1600 100V200H0Z'/%3E%3Cpath fill='none' stroke='%237cb3ff' stroke-opacity='0.28' stroke-width='1.5' vector-effect='non-scaling-stroke' d='M0 100C200 40 600 40 800 100S1400 160 1600 100'/%3E%3C/svg%3E\"),\n\t\turl(\"data:image/svg+xml,%3Csvg xmlns='http://www.w3.org/2000/svg' viewBox='0 0 1600 200' preserveAspectRatio='none'%3E%3Cpath fill='%235b9dff' fill-opacity='0.12' d='M0 100C200 40 600 40 800 100S1400 160 1600 100V200H0Z'/%3E%3Cpath fill='none' stroke='%239cc8ff' stroke-opacity='0.18' stroke-width='1.5' vector-effect='non-scaling-stroke' d='M0 100C200 40 600 40 800 100S1400 160 1600 100'/%3E%3C/svg%3E\"),\n\t\turl(\"data:image/svg+xml,%3Csvg xmlns='http://www.w3.org/2000/svg' viewBox='0 0 1600 200' preserveAspectRatio='none'%3E%3Cpath fill='%234ecdc4' fill-opacity='0.09' d='M0 100C200 40 600 40 800 100S1400 160 1600 100V200H0Z'/%3E%3C/svg%3E\");\n\tbackground-repeat: repeat-x;\n\tbackground-position: 0 100%, 0 100%, 0 100%;\n\tbackground-size: 760px 52%, 1100px 78%, 1600px 100%;\n\tanimation:\n\t\tocean-swell 20s linear infinite,\n\t\tocean-heave 4.6s ease-in-out infinite alternate;\n}\n.pizza-splash__icon {\n\tfilter: drop-shadow(0 8px 22px rgba(78, 205, 196, 0.35));\n\tanimation: ocean-bob 3.2s ease-in-out infinite;\n}\n.pizza-splash__message {\n\tcolor: #8fb3cf;\n\tletter-spacing: 0.02em;\n}\n/* Exit: the content sinks while the water fades away. */\n.pizza-splash[data-state=\"exiting\"] .pizza-splash__content {\n\topacity: 0;\n\ttransform: translateY(10px);\n\ttransition: opacity 500ms ease-in, transform 600ms ease-in;\n}\n@keyframes ocean-caustics {\n\tfrom { transform: translate3d(-4%, 0, 0) scale(1); }\n\tto { transform: translate3d(4%, 3%, 0) scale(1.08); }\n}\n@keyframes ocean-swell {\n\tto { background-position: -3040px 100%, -2200px 100%, -1600px 100%; }\n}\n@keyframes ocean-heave {\n\tfrom { transform: translateY(0); }\n\tto { transform: translateY(-8px); }\n}\n@keyframes ocean-bob {\n\t0%, 100% { transform: translateY(0) rotate(-2deg); }\n\t50% { transform: translateY(-7px) rotate(2deg); }\n}\n/* Reduced motion: no bob/parallax pop, but the water still breathes — much\n   slower and gentler. `!important` re-enables animation after the app's\n   reduced-motion default kills it (theme css is injected later, and these\n   selectors are more specific than `.pizza-splash *`). */\n@media (prefers-reduced-motion: reduce) {\n\t.pizza-splash {\n\t\ttransition: opacity 140ms linear, visibility 0s linear 140ms !important;\n\t}\n\t.pizza-splash .pizza-splash__backdrop::before {\n\t\tanimation: ocean-caustics 20s ease-in-out infinite alternate !important;\n\t}\n\t.pizza-splash .pizza-splash__backdrop::after {\n\t\tanimation: ocean-swell 50s linear infinite !important;\n\t}\n\t.pizza-splash[data-state=\"exiting\"] .pizza-splash__content {\n\t\ttransform: none;\n\t\ttransition: opacity 140ms linear !important;\n\t}\n}\n",
			"minDurationMs": 900
		}
	}
}
